{
  "schemaVersion": "shockaudit-screen03-evidence-confirmability-benchmark-v1",
  "benchmarkId": "screen03-cross-platform-v1",
  "frozen": true,
  "productionImportForbidden": true,
  "reviewedAt": "2026-09-03T00:00:00.000Z",
  "cases": [
    {
      "eventId": "fixture-eu-gdpr",
      "claimId": "gdpr-title",
      "claimType": "identity",
      "sourcePlatform": "EU CELLAR JSON",
      "sourceId": "fixture-eu-cellar-1",
      "authorityTier": 1,
      "evidenceBasis": "official-structured-field",
      "expectedSupportClass": "direct",
      "expectedConfirmability": true,
      "expectedReason": "confirmable",
      "exactOfficialSupport": "Regulation (EU) 2016/679",
      "input": { "group": "identity", "label": "Canonical title", "value": "Regulation (EU) 2016/679", "proposalSupport": "direct", "sourceRole": "controlling-legal-record", "sourcePlatform": "eur-lex", "documentType": "structured-metadata", "evidenceStatus": "retrieved", "passages": [{ "text": "Regulation (EU) 2016/679", "basis": "official-record-field", "officialField": "canonical-title" }], "conflict": false, "sourceChange": { "targetRelation": "claim-linked-source", "preChangeDecision": "accept" } },
      "actions": {
        "confirm": "enabled-and-persists",
        "correct": "available",
        "unresolved": "available-and-persists",
        "reject": "available-and-persists",
        "restore": "preserves-decision",
        "sourceChange": "reopens-decision",
        "hostMapping": "not-required"
      },
      "scenarioTags": ["gdpr", "audit", "structured-metadata"],
      "reviewedAt": "2026-09-03T00:00:00.000Z"
    },
    {
      "eventId": "fixture-eu-gdpr",
      "claimId": "gdpr-coverage",
      "claimType": "coverage",
      "sourcePlatform": "EUR-Lex HTML",
      "sourceId": "fixture-eurlex-1",
      "authorityTier": 1,
      "evidenceBasis": "official-passage",
      "expectedSupportClass": "direct",
      "expectedConfirmability": true,
      "expectedReason": "confirmable",
      "exactOfficialSupport": "This Regulation applies to the processing of personal data in the context of the activities of an establishment of a controller or a processor in the Union.",
      "input": { "group": "eligibility", "label": "coverage", "value": "This Regulation applies to the processing of personal data in the context of the activities of an establishment of a controller or a processor in the Union.", "proposalSupport": "direct", "sourceRole": "controlling-legal-record", "sourcePlatform": "eur-lex", "documentType": "html", "evidenceStatus": "retrieved", "passages": [{ "text": "This Regulation applies to the processing of personal data in the context of the activities of an establishment of a controller or a processor in the Union.", "basis": "official-document-passage", "officialField": null }], "conflict": false, "sourceChange": { "targetRelation": "claim-linked-source", "preChangeDecision": "accept" } },
      "actions": {
        "confirm": "enabled-and-persists",
        "correct": "available",
        "unresolved": "available-and-persists",
        "reject": "available-and-persists",
        "restore": "preserves-decision",
        "sourceChange": "reopens-decision",
        "hostMapping": "may-propose-noncanonical"
      },
      "scenarioTags": ["gdpr", "find", "official-html"],
      "reviewedAt": "2026-09-03T00:00:00.000Z"
    },
    {
      "eventId": "fixture-us-ccpa",
      "claimId": "ccpa-identifier",
      "claimType": "identity",
      "sourcePlatform": "California Legislative Information",
      "sourceId": "fixture-ca-leginfo-1",
      "authorityTier": 1,
      "evidenceBasis": "official-structured-field",
      "expectedSupportClass": "direct",
      "expectedConfirmability": true,
      "expectedReason": "confirmable",
      "exactOfficialSupport": "AB-375",
      "input": { "group": "identity", "label": "Formal identifier", "value": "AB-375", "proposalSupport": "direct", "sourceRole": "controlling-legal-record", "sourcePlatform": "us-state-official", "documentType": "structured-metadata", "evidenceStatus": "retrieved", "passages": [{ "text": "AB-375", "basis": "official-record-field", "officialField": "formal-identifier" }], "conflict": false, "sourceChange": { "targetRelation": "claim-linked-source", "preChangeDecision": "accept" } },
      "actions": {
        "confirm": "enabled-and-persists",
        "correct": "available",
        "unresolved": "available-and-persists",
        "reject": "available-and-persists",
        "restore": "preserves-decision",
        "sourceChange": "reopens-decision",
        "hostMapping": "not-required"
      },
      "scenarioTags": ["ccpa", "us-state-law"],
      "reviewedAt": "2026-09-03T00:00:00.000Z"
    },
    {
      "eventId": "fixture-us-state-law",
      "claimId": "state-effective-date",
      "claimType": "timeline",
      "sourcePlatform": "Official state legislature XML",
      "sourceId": "fixture-state-xml-1",
      "authorityTier": 1,
      "evidenceBasis": "official-passage",
      "expectedSupportClass": "direct",
      "expectedConfirmability": true,
      "expectedReason": "confirmable",
      "exactOfficialSupport": "This act takes effect on January 1, 2021.",
      "input": { "group": "timeline", "label": "timeline", "value": "2021-01-01", "proposalSupport": "direct", "sourceRole": "controlling-legal-record", "sourcePlatform": "us-state-official", "documentType": "xml", "evidenceStatus": "retrieved", "passages": [{ "text": "This act takes effect on January 1, 2021.", "basis": "official-document-passage", "officialField": null }], "conflict": false, "sourceChange": { "targetRelation": "claim-linked-source", "preChangeDecision": "accept" } },
      "actions": {
        "confirm": "enabled-and-persists",
        "correct": "available",
        "unresolved": "available-and-persists",
        "reject": "available-and-persists",
        "restore": "preserves-decision",
        "sourceChange": "reopens-decision",
        "hostMapping": "may-propose-noncanonical"
      },
      "scenarioTags": ["us-state-law", "official-xml"],
      "reviewedAt": "2026-09-03T00:00:00.000Z"
    },
    {
      "eventId": "fixture-us-federal-rule",
      "claimId": "fr-issuer",
      "claimType": "identity",
      "sourcePlatform": "Federal Register API",
      "sourceId": "fixture-fr-json-1",
      "authorityTier": 1,
      "evidenceBasis": "official-structured-field",
      "expectedSupportClass": "direct",
      "expectedConfirmability": true,
      "expectedReason": "confirmable",
      "exactOfficialSupport": "Securities and Exchange Commission",
      "input": { "group": "identity", "label": "Issuer", "value": "Securities and Exchange Commission", "proposalSupport": "direct", "sourceRole": "official-publication-record", "sourcePlatform": "federal-register", "documentType": "structured-metadata", "evidenceStatus": "retrieved", "passages": [{ "text": "Securities and Exchange Commission", "basis": "official-record-field", "officialField": "issuer" }], "conflict": false, "sourceChange": { "targetRelation": "claim-linked-source", "preChangeDecision": "accept" } },
      "actions": {
        "confirm": "enabled-and-persists",
        "correct": "available",
        "unresolved": "available-and-persists",
        "reject": "available-and-persists",
        "restore": "preserves-decision",
        "sourceChange": "reopens-decision",
        "hostMapping": "not-required"
      },
      "scenarioTags": ["us-federal", "official-json"],
      "reviewedAt": "2026-09-03T00:00:00.000Z"
    },
    {
      "eventId": "fixture-eu-instrument",
      "claimId": "eu-duty",
      "claimType": "substantive",
      "sourcePlatform": "EUR-Lex XML",
      "sourceId": "fixture-eu-xml-1",
      "authorityTier": 1,
      "evidenceBasis": "official-passage",
      "expectedSupportClass": "direct",
      "expectedConfirmability": true,
      "expectedReason": "confirmable",
      "exactOfficialSupport": "Member States shall require undertakings to publish the report annually.",
      "input": { "group": "overview", "label": "substantive", "value": "Member States shall require undertakings to publish the report annually.", "proposalSupport": "direct", "sourceRole": "controlling-legal-record", "sourcePlatform": "eur-lex", "documentType": "xml", "evidenceStatus": "retrieved", "passages": [{ "text": "Member States shall require undertakings to publish the report annually.", "basis": "official-document-passage", "officialField": null }], "conflict": false, "sourceChange": { "targetRelation": "claim-linked-source", "preChangeDecision": "accept" } },
      "actions": {
        "confirm": "enabled-and-persists",
        "correct": "available",
        "unresolved": "available-and-persists",
        "reject": "available-and-persists",
        "restore": "preserves-decision",
        "sourceChange": "reopens-decision",
        "hostMapping": "may-propose-noncanonical"
      },
      "scenarioTags": ["another-eu-instrument", "official-xml"],
      "reviewedAt": "2026-09-03T00:00:00.000Z"
    },
    {
      "eventId": "fixture-japan-regulation",
      "claimId": "japan-title",
      "claimType": "identity",
      "sourcePlatform": "e-Gov JSON",
      "sourceId": "fixture-japan-json-1",
      "authorityTier": 1,
      "evidenceBasis": "official-structured-field",
      "expectedSupportClass": "direct",
      "expectedConfirmability": true,
      "expectedReason": "confirmable",
      "exactOfficialSupport": "Act on Improvement of Employment Management",